{
  "schemaVersion": 1,
  "packageId": "11111111-1111-4111-8111-111111111111",
  "sourceSystemId": "22222222-2222-4222-8222-222222222222",
  "sourceRunId": "33333333-3333-4333-8333-333333333333",
  "outcomeRevisionId": "44444444-4444-4444-8444-444444444444",
  "exportedAt": "2026-10-11T00:00:00Z",
  "content": {
    "redactedQuestion": "订单同步失败，请依据脱敏证据分析。",
    "redactedSummary": "合成协议样例，不是真实业务数据。",
    "outcomeStatus": "UNCONFIRMED"
  },
  "redactionConfirmedAt": "2026-10-11T00:00:00Z",
  "contentSha256": "dd77b3ce0a011fe30cb17f59b189f65c2a6ac24e23731cb0b3ed9109fc109202"
}
